{
  "artifacts": [
    {
      "entries": [],
      "format": "wheel",
      "path": "dist/demo-1.0.0-py3-none-any.whl",
      "sha256": "cccccccccccccccccccccccccccccccccccccccccccccccccccccccccccccccc",
      "size": 2048
    }
  ],
  "baseline_fingerprints": [],
  "counts": {
    "critical": 0,
    "high": 1,
    "info": 0,
    "low": 0,
    "medium": 0
  },
  "findings": [
    {
      "evidence": [
        {
          "key": "declared entry point",
          "value": "demo=demo.cli:main"
        },
        {
          "key": "artifact lookup",
          "value": "demo/cli.py was not found"
        }
      ],
      "fingerprint": "aaaaaaaaaaaaaaaaaaaaaaaa",
      "location": "dist/demo-1.0.0-py3-none-any.whl",
      "message": "The release artifact does not contain the module required by its declared console entry point.",
      "package": "demo",
      "remediation": "Include demo/cli.py in the wheel, rebuild the release artifact, and rerun the static scan.",
      "rule_id": "common.missing-entrypoint",
      "severity": "high",
      "title": "Missing packaged entry point"
    }
  ],
  "packages": [
    {
      "ecosystem": "python",
      "entrypoints": ["console:demo=demo.cli:main"],
      "expected_files": ["README.md"],
      "internal_dependencies": [],
      "manifest": "pyproject.toml",
      "name": "demo",
      "root": ".",
      "version": "1.0.0"
    }
  ],
  "root": ".",
  "scan_id": "dddddddddddddddddddddddddddddddddddddddddddddddddddddddddddddddd",
  "schema_version": "1",
  "tool_version": "1.1.0"
}
