{
  "artifacts": [],
  "baseline_fingerprints": [],
  "counts": {
    "critical": 0,
    "high": 0,
    "info": 0,
    "low": 0,
    "medium": 0
  },
  "findings": [],
  "packages": [
    {
      "ecosystem": "python",
      "entrypoints": [
        "console:packrehearsal=packrehearsal.cli:main"
      ],
      "expected_files": [
        "README.md"
      ],
      "internal_dependencies": [],
      "license": "Apache-2.0",
      "manifest": "pyproject.toml",
      "metadata": {
        "build_system": {
          "build-backend": "hatchling.build",
          "requires": [
            "hatchling>=1.25"
          ]
        },
        "dynamic_version": false,
        "metadata_source": "pep621",
        "requires_python": ">=3.11"
      },
      "name": "packrehearsal",
      "readme": "README.md",
      "root": ".",
      "version": "1.1.0"
    }
  ],
  "root": ".",
  "scan_id": "8b76a21618f03d09916b2cda8ccf06a12f81566a8de53ed4d5871233275a6edd",
  "schema_version": "1",
  "tool_version": "1.1.0"
}
